{
    "2025-07-29": [
        {
            "date": "2025-07-29",
            "time": "00:00:00",
            "date display": "29.07.2025",
            "price_eur": 97.09,
            "price": 189.89,
            "volume": 3067.2
        },
        {
            "date": "2025-07-29",
            "time": "01:00:00",
            "date display": "29.07.2025",
            "price_eur": 93.01,
            "price": 181.91,
            "volume": 3292.7
        },
        {
            "date": "2025-07-29",
            "time": "02:00:00",
            "date display": "29.07.2025",
            "price_eur": 87.09,
            "price": 170.33,
            "volume": 3322.5
        },
        {
            "date": "2025-07-29",
            "time": "03:00:00",
            "date display": "29.07.2025",
            "price_eur": 86.66,
            "price": 169.49,
            "volume": 3299.0
        },
        {
            "date": "2025-07-29",
            "time": "04:00:00",
            "date display": "29.07.2025",
            "price_eur": 88.89,
            "price": 173.85,
            "volume": 3212.7
        },
        {
            "date": "2025-07-29",
            "time": "05:00:00",
            "date display": "29.07.2025",
            "price_eur": 99.03,
            "price": 193.69,
            "volume": 3303.1
        },
        {
            "date": "2025-07-29",
            "time": "06:00:00",
            "date display": "29.07.2025",
            "price_eur": 108.47,
            "price": 212.15,
            "volume": 2900.4
        },
        {
            "date": "2025-07-29",
            "time": "07:00:00",
            "date display": "29.07.2025",
            "price_eur": 104.61,
            "price": 204.6,
            "volume": 2488.8
        },
        {
            "date": "2025-07-29",
            "time": "08:00:00",
            "date display": "29.07.2025",
            "price_eur": 88.88,
            "price": 173.83,
            "volume": 3191.8
        },
        {
            "date": "2025-07-29",
            "time": "09:00:00",
            "date display": "29.07.2025",
            "price_eur": 69.76,
            "price": 136.44,
            "volume": 3193.3
        },
        {
            "date": "2025-07-29",
            "time": "10:00:00",
            "date display": "29.07.2025",
            "price_eur": 54.44,
            "price": 106.48,
            "volume": 3400.7
        },
        {
            "date": "2025-07-29",
            "time": "11:00:00",
            "date display": "29.07.2025",
            "price_eur": 40.46,
            "price": 79.13,
            "volume": 3226.5
        },
        {
            "date": "2025-07-29",
            "time": "12:00:00",
            "date display": "29.07.2025",
            "price_eur": 24.79,
            "price": 48.49,
            "volume": 2760.2
        },
        {
            "date": "2025-07-29",
            "time": "13:00:00",
            "date display": "29.07.2025",
            "price_eur": 17.69,
            "price": 34.6,
            "volume": 2982.2
        },
        {
            "date": "2025-07-29",
            "time": "14:00:00",
            "date display": "29.07.2025",
            "price_eur": 10.7,
            "price": 20.93,
            "volume": 3295.4
        },
        {
            "date": "2025-07-29",
            "time": "15:00:00",
            "date display": "29.07.2025",
            "price_eur": 28.38,
            "price": 0.0,
            "volume": 3455.2
        },
        {
            "date": "2025-07-29",
            "time": "16:00:00",
            "date display": "29.07.2025",
            "price_eur": 71.59,
            "price": 140.02,
            "volume": 2872.9
        },
        {
            "date": "2025-07-29",
            "time": "17:00:00",
            "date display": "29.07.2025",
            "price_eur": 92.7,
            "price": 181.31,
            "volume": 3128.5
        },
        {
            "date": "2025-07-29",
            "time": "18:00:00",
            "date display": "29.07.2025",
            "price_eur": 170.36,
            "price": 333.2,
            "volume": 2627.0
        },
        {
            "date": "2025-07-29",
            "time": "19:00:00",
            "date display": "29.07.2025",
            "price_eur": 183.77,
            "price": 11.42,
            "volume": 2524.2
        },
        {
            "date": "2025-07-29",
            "time": "20:00:00",
            "date display": "29.07.2025",
            "price_eur": 223.94,
            "price": 12.99,
            "volume": 2389.6
        },
        {
            "date": "2025-07-29",
            "time": "21:00:00",
            "date display": "29.07.2025",
            "price_eur": 178.39,
            "price": 13.9,
            "volume": 2454.5
        },
        {
            "date": "2025-07-29",
            "time": "22:00:00",
            "date display": "29.07.2025",
            "price_eur": 135.33,
            "price": 264.68,
            "volume": 2614.4
        },
        {
            "date": "2025-07-29",
            "time": "23:00:00",
            "date display": "29.07.2025",
            "price_eur": 102.97,
            "price": 201.39,
            "volume": 3137.2
        }
    ],
    "2025-07-30": [
        {
            "date": "2025-07-30",
            "time": "00:00:00",
            "date display": "30.07.2025",
            "price_eur": 97.09,
            "price": 189.89,
            "volume": 3067.2
        },
        {
            "date": "2025-07-30",
            "time": "01:00:00",
            "date display": "30.07.2025",
            "price_eur": 93.01,
            "price": 181.91,
            "volume": 3292.7
        },
        {
            "date": "2025-07-30",
            "time": "02:00:00",
            "date display": "30.07.2025",
            "price_eur": 87.09,
            "price": 170.33,
            "volume": 3322.5
        },
        {
            "date": "2025-07-30",
            "time": "03:00:00",
            "date display": "30.07.2025",
            "price_eur": 86.66,
            "price": 169.49,
            "volume": 3299.0
        },
        {
            "date": "2025-07-30",
            "time": "04:00:00",
            "date display": "30.07.2025",
            "price_eur": 88.89,
            "price": 173.85,
            "volume": 3212.7
        },
        {
            "date": "2025-07-30",
            "time": "05:00:00",
            "date display": "30.07.2025",
            "price_eur": 99.03,
            "price": 193.69,
            "volume": 3303.1
        },
        {
            "date": "2025-07-30",
            "time": "06:00:00",
            "date display": "30.07.2025",
            "price_eur": 108.47,
            "price": 212.15,
            "volume": 2900.4
        },
        {
            "date": "2025-07-30",
            "time": "07:00:00",
            "date display": "30.07.2025",
            "price_eur": 104.61,
            "price": 204.6,
            "volume": 2488.8
        },
        {
            "date": "2025-07-30",
            "time": "08:00:00",
            "date display": "30.07.2025",
            "price_eur": 88.88,
            "price": 173.83,
            "volume": 3191.8
        },
        {
            "date": "2025-07-30",
            "time": "09:00:00",
            "date display": "30.07.2025",
            "price_eur": 69.76,
            "price": 136.44,
            "volume": 3193.3
        },
        {
            "date": "2025-07-30",
            "time": "10:00:00",
            "date display": "30.07.2025",
            "price_eur": 54.44,
            "price": 106.48,
            "volume": 3400.7
        },
        {
            "date": "2025-07-30",
            "time": "11:00:00",
            "date display": "30.07.2025",
            "price_eur": 40.46,
            "price": 79.13,
            "volume": 3226.5
        },
        {
            "date": "2025-07-30",
            "time": "12:00:00",
            "date display": "30.07.2025",
            "price_eur": 24.79,
            "price": 48.49,
            "volume": 2760.2
        },
        {
            "date": "2025-07-30",
            "time": "13:00:00",
            "date display": "30.07.2025",
            "price_eur": 17.69,
            "price": 34.6,
            "volume": 2982.2
        },
        {
            "date": "2025-07-30",
            "time": "14:00:00",
            "date display": "30.07.2025",
            "price_eur": 10.7,
            "price": 20.93,
            "volume": 3295.4
        },
        {
            "date": "2025-07-30",
            "time": "15:00:00",
            "date display": "30.07.2025",
            "price_eur": 28.38,
            "price": 0.0,
            "volume": 3455.2
        },
        {
            "date": "2025-07-30",
            "time": "16:00:00",
            "date display": "30.07.2025",
            "price_eur": 71.59,
            "price": 140.02,
            "volume": 2872.9
        },
        {
            "date": "2025-07-30",
            "time": "17:00:00",
            "date display": "30.07.2025",
            "price_eur": 92.7,
            "price": 181.31,
            "volume": 3128.5
        },
        {
            "date": "2025-07-30",
            "time": "18:00:00",
            "date display": "30.07.2025",
            "price_eur": 170.36,
            "price": 333.2,
            "volume": 2627.0
        },
        {
            "date": "2025-07-30",
            "time": "19:00:00",
            "date display": "30.07.2025",
            "price_eur": 183.77,
            "price": 359.42,
            "volume": 2524.2
        },
        {
            "date": "2025-07-30",
            "time": "20:00:00",
            "date display": "30.07.2025",
            "price_eur": 223.94,
            "price": 437.99,
            "volume": 2389.6
        },
        {
            "date": "2025-07-30",
            "time": "21:00:00",
            "date display": "30.07.2025",
            "price_eur": 178.39,
            "price": 348.9,
            "volume": 2454.5
        },
        {
            "date": "2025-07-30",
            "time": "22:00:00",
            "date display": "30.07.2025",
            "price_eur": 135.33,
            "price": 264.68,
            "volume": 2614.4
        },
        {
            "date": "2025-07-30",
            "time": "23:00:00",
            "date display": "30.07.2025",
            "price_eur": 102.97,
            "price": 201.39,
            "volume": 3137.2
        }
    ],
    "2025-07-31": [
        {
            "date": "2025-07-31",
            "time": "00:00:00",
            "date display": "31.07.2025",
            "price_eur": 101.31,
            "price": 198.15,
            "volume": 3020.0
        },
        {
            "date": "2025-07-31",
            "time": "01:00:00",
            "date display": "31.07.2025",
            "price_eur": 96.47,
            "price": 188.68,
            "volume": 3366.2
        },
        {
            "date": "2025-07-31",
            "time": "02:00:00",
            "date display": "31.07.2025",
            "price_eur": 77.91,
            "price": 152.38,
            "volume": 3339.6
        },
        {
            "date": "2025-07-31",
            "time": "03:00:00",
            "date display": "31.07.2025",
            "price_eur": 74.67,
            "price": 146.04,
            "volume": 3383.7
        },
        {
            "date": "2025-07-31",
            "time": "04:00:00",
            "date display": "31.07.2025",
            "price_eur": 78.26,
            "price": 153.06,
            "volume": 3305.6
        },
        {
            "date": "2025-07-31",
            "time": "05:00:00",
            "date display": "31.07.2025",
            "price_eur": 93.7,
            "price": 183.26,
            "volume": 3007.1
        },
        {
            "date": "2025-07-31",
            "time": "06:00:00",
            "date display": "31.07.2025",
            "price_eur": 104.89,
            "price": 205.15,
            "volume": 2631.3
        },
        {
            "date": "2025-07-31",
            "time": "07:00:00",
            "date display": "31.07.2025",
            "price_eur": 101.29,
            "price": 198.11,
            "volume": 2801.8
        },
        {
            "date": "2025-07-31",
            "time": "08:00:00",
            "date display": "31.07.2025",
            "price_eur": 93.86,
            "price": 183.57,
            "volume": 2631.8
        },
        {
            "date": "2025-07-31",
            "time": "09:00:00",
            "date display": "31.07.2025",
            "price_eur": 83.43,
            "price": 163.17,
            "volume": 2481.2
        },
        {
            "date": "2025-07-31",
            "time": "10:00:00",
            "date display": "31.07.2025",
            "price_eur": 73.26,
            "price": 143.28,
            "volume": 2936.7
        },
        {
            "date": "2025-07-31",
            "time": "11:00:00",
            "date display": "31.07.2025",
            "price_eur": 72.99,
            "price": 142.76,
            "volume": 3132.6
        },
        {
            "date": "2025-07-31",
            "time": "12:00:00",
            "date display": "31.07.2025",
            "price_eur": 63.22,
            "price": 123.65,
            "volume": 3469.4
        },
        {
            "date": "2025-07-31",
            "time": "13:00:00",
            "date display": "31.07.2025",
            "price_eur": 50.29,
            "price": 98.36,
            "volume": 3708.7
        },
        {
            "date": "2025-07-31",
            "time": "14:00:00",
            "date display": "31.07.2025",
            "price_eur": 63.03,
            "price": 123.28,
            "volume": 3549.0
        },
        {
            "date": "2025-07-31",
            "time": "15:00:00",
            "date display": "31.07.2025",
            "price_eur": 79.1,
            "price": 154.71,
            "volume": 2860.3
        },
        {
            "date": "2025-07-31",
            "time": "16:00:00",
            "date display": "31.07.2025",
            "price_eur": 98.46,
            "price": 192.57,
            "volume": 2518.8
        },
        {
            "date": "2025-07-31",
            "time": "17:00:00",
            "date display": "31.07.2025",
            "price_eur": 101.56,
            "price": 198.63,
            "volume": 2759.2
        },
        {
            "date": "2025-07-31",
            "time": "18:00:00",
            "date display": "31.07.2025",
            "price_eur": 148.77,
            "price": 290.97,
            "volume": 2503.0
        },
        {
            "date": "2025-07-31",
            "time": "19:00:00",
            "date display": "31.07.2025",
            "price_eur": 136.61,
            "price": 267.19,
            "volume": 2902.0
        },
        {
            "date": "2025-07-31",
            "time": "20:00:00",
            "date display": "31.07.2025",
            "price_eur": 151.92,
            "price": 297.13,
            "volume": 2973.8
        },
        {
            "date": "2025-07-31",
            "time": "21:00:00",
            "date display": "31.07.2025",
            "price_eur": 157.46,
            "price": 307.96,
            "volume": 2811.7
        },
        {
            "date": "2025-07-31",
            "time": "22:00:00",
            "date display": "31.07.2025",
            "price_eur": 148.77,
            "price": 290.97,
            "volume": 2601.6
        },
        {
            "date": "2025-07-31",
            "time": "23:00:00",
            "date display": "31.07.2025",
            "price_eur": 103.88,
            "price": 203.17,
            "volume": 2779.9
        }
    ],
    "2025-08-01": [
        {
            "date": "2025-08-01",
            "time": "00:00:00",
            "date display": "01.08.2025",
            "price_eur": 105.8,
            "price": 206.93,
            "volume": 2715.4
        },
        {
            "date": "2025-08-01",
            "time": "01:00:00",
            "date display": "01.08.2025",
            "price_eur": 99.26,
            "price": 194.14,
            "volume": 2942.7
        },
        {
            "date": "2025-08-01",
            "time": "02:00:00",
            "date display": "01.08.2025",
            "price_eur": 91.62,
            "price": 179.19,
            "volume": 2703.6
        },
        {
            "date": "2025-08-01",
            "time": "03:00:00",
            "date display": "01.08.2025",
            "price_eur": 87.87,
            "price": 171.86,
            "volume": 2735.4
        },
        {
            "date": "2025-08-01",
            "time": "04:00:00",
            "date display": "01.08.2025",
            "price_eur": 93.38,
            "price": 182.64,
            "volume": 2513.6
        },
        {
            "date": "2025-08-01",
            "time": "05:00:00",
            "date display": "01.08.2025",
            "price_eur": 100.5,
            "price": 196.56,
            "volume": 2565.5
        },
        {
            "date": "2025-08-01",
            "time": "06:00:00",
            "date display": "01.08.2025",
            "price_eur": 105.82,
            "price": 206.97,
            "volume": 2661.0
        },
        {
            "date": "2025-08-01",
            "time": "07:00:00",
            "date display": "01.08.2025",
            "price_eur": 109.48,
            "price": 214.12,
            "volume": 2742.0
        },
        {
            "date": "2025-08-01",
            "time": "08:00:00",
            "date display": "01.08.2025",
            "price_eur": 105.61,
            "price": 206.56,
            "volume": 2786.6
        },
        {
            "date": "2025-08-01",
            "time": "09:00:00",
            "date display": "01.08.2025",
            "price_eur": 75.82,
            "price": 148.29,
            "volume": 2862.8
        },
        {
            "date": "2025-08-01",
            "time": "10:00:00",
            "date display": "01.08.2025",
            "price_eur": 65.28,
            "price": 127.68,
            "volume": 3073.6
        },
        {
            "date": "2025-08-01",
            "time": "11:00:00",
            "date display": "01.08.2025",
            "price_eur": 66.94,
            "price": 130.92,
            "volume": 3001.1
        },
        {
            "date": "2025-08-01",
            "time": "12:00:00",
            "date display": "01.08.2025",
            "price_eur": 68.1,
            "price": 133.19,
            "volume": 2939.5
        },
        {
            "date": "2025-08-01",
            "time": "13:00:00",
            "date display": "01.08.2025",
            "price_eur": 64.96,
            "price": 127.05,
            "volume": 2927.5
        },
        {
            "date": "2025-08-01",
            "time": "14:00:00",
            "date display": "01.08.2025",
            "price_eur": 51.44,
            "price": 100.61,
            "volume": 2935.8
        },
        {
            "date": "2025-08-01",
            "time": "15:00:00",
            "date display": "01.08.2025",
            "price_eur": 52.02,
            "price": 101.74,
            "volume": 2747.4
        },
        {
            "date": "2025-08-01",
            "time": "16:00:00",
            "date display": "01.08.2025",
            "price_eur": 74.29,
            "price": 145.3,
            "volume": 2638.2
        },
        {
            "date": "2025-08-01",
            "time": "17:00:00",
            "date display": "01.08.2025",
            "price_eur": 108.5,
            "price": 212.21,
            "volume": 2462.5
        },
        {
            "date": "2025-08-01",
            "time": "18:00:00",
            "date display": "01.08.2025",
            "price_eur": 148.71,
            "price": 290.85,
            "volume": 2700.3
        },
        {
            "date": "2025-08-01",
            "time": "19:00:00",
            "date display": "01.08.2025",
            "price_eur": 161.91,
            "price": 316.67,
            "volume": 3143.6
        },
        {
            "date": "2025-08-01",
            "time": "20:00:00",
            "date display": "01.08.2025",
            "price_eur": 209.35,
            "price": 409.45,
            "volume": 3187.9
        },
        {
            "date": "2025-08-01",
            "time": "21:00:00",
            "date display": "01.08.2025",
            "price_eur": 209.87,
            "price": 410.47,
            "volume": 3049.0
        },
        {
            "date": "2025-08-01",
            "time": "22:00:00",
            "date display": "01.08.2025",
            "price_eur": 136.83,
            "price": 267.62,
            "volume": 2660.9
        },
        {
            "date": "2025-08-01",
            "time": "23:00:00",
            "date display": "01.08.2025",
            "price_eur": 112.34,
            "price": 219.72,
            "volume": 2612.8
        }
    ],
    "2025-08-02": [
        {
            "date": "2025-08-02",
            "time": "00:00:00",
            "date display": "02.08.2025",
            "price_eur": 112.9,
            "price": 220.81,
            "volume": 2377.4
        },
        {
            "date": "2025-08-02",
            "time": "01:00:00",
            "date display": "02.08.2025",
            "price_eur": 101.13,
            "price": 197.79,
            "volume": 2384.6
        },
        {
            "date": "2025-08-02",
            "time": "02:00:00",
            "date display": "02.08.2025",
            "price_eur": 96.78,
            "price": 189.29,
            "volume": 2241.4
        },
        {
            "date": "2025-08-02",
            "time": "03:00:00",
            "date display": "02.08.2025",
            "price_eur": 90.6,
            "price": 177.2,
            "volume": 2332.2
        },
        {
            "date": "2025-08-02",
            "time": "04:00:00",
            "date display": "02.08.2025",
            "price_eur": 89.73,
            "price": 175.5,
            "volume": 2435.6
        },
        {
            "date": "2025-08-02",
            "time": "05:00:00",
            "date display": "02.08.2025",
            "price_eur": 89.38,
            "price": 174.81,
            "volume": 2374.2
        },
        {
            "date": "2025-08-02",
            "time": "06:00:00",
            "date display": "02.08.2025",
            "price_eur": 87.99,
            "price": 172.09,
            "volume": 2153.2
        },
        {
            "date": "2025-08-02",
            "time": "07:00:00",
            "date display": "02.08.2025",
            "price_eur": 83.26,
            "price": 162.84,
            "volume": 2403.7
        },
        {
            "date": "2025-08-02",
            "time": "08:00:00",
            "date display": "02.08.2025",
            "price_eur": 60.23,
            "price": 117.8,
            "volume": 2902.2
        },
        {
            "date": "2025-08-02",
            "time": "09:00:00",
            "date display": "02.08.2025",
            "price_eur": 13.62,
            "price": 26.64,
            "volume": 3428.9
        },
        {
            "date": "2025-08-02",
            "time": "10:00:00",
            "date display": "02.08.2025",
            "price_eur": 8.43,
            "price": 16.49,
            "volume": 3221.4
        },
        {
            "date": "2025-08-02",
            "time": "11:00:00",
            "date display": "02.08.2025",
            "price_eur": 5.68,
            "price": 11.11,
            "volume": 2993.3
        },
        {
            "date": "2025-08-02",
            "time": "12:00:00",
            "date display": "02.08.2025",
            "price_eur": 2.95,
            "price": 5.77,
            "volume": 2840.4
        },
        {
            "date": "2025-08-02",
            "time": "13:00:00",
            "date display": "02.08.2025",
            "price_eur": 0.0,
            "price": 0.0,
            "volume": 3392.2
        },
        {
            "date": "2025-08-02",
            "time": "14:00:00",
            "date display": "02.08.2025",
            "price_eur": 0.0,
            "price": 0.0,
            "volume": 3930.3
        },
        {
            "date": "2025-08-02",
            "time": "15:00:00",
            "date display": "02.08.2025",
            "price_eur": 0.0,
            "price": 0.0,
            "volume": 3950.2
        },
        {
            "date": "2025-08-02",
            "time": "16:00:00",
            "date display": "02.08.2025",
            "price_eur": 5.61,
            "price": 10.97,
            "volume": 2518.6
        },
        {
            "date": "2025-08-02",
            "time": "17:00:00",
            "date display": "02.08.2025",
            "price_eur": 63.73,
            "price": 124.65,
            "volume": 3059.4
        },
        {
            "date": "2025-08-02",
            "time": "18:00:00",
            "date display": "02.08.2025",
            "price_eur": 95.54,
            "price": 186.86,
            "volume": 2044.8
        },
        {
            "date": "2025-08-02",
            "time": "19:00:00",
            "date display": "02.08.2025",
            "price_eur": 136.42,
            "price": 266.81,
            "volume": 2938.9
        },
        {
            "date": "2025-08-02",
            "time": "20:00:00",
            "date display": "02.08.2025",
            "price_eur": 180.0,
            "price": 352.05,
            "volume": 3057.0
        },
        {
            "date": "2025-08-02",
            "time": "21:00:00",
            "date display": "02.08.2025",
            "price_eur": 149.71,
            "price": 292.81,
            "volume": 3004.6
        },
        {
            "date": "2025-08-02",
            "time": "22:00:00",
            "date display": "02.08.2025",
            "price_eur": 121.03,
            "price": 236.71,
            "volume": 2393.9
        },
        {
            "date": "2025-08-02",
            "time": "23:00:00",
            "date display": "02.08.2025",
            "price_eur": 96.53,
            "price": 188.8,
            "volume": 2973.6
        }
    ],
    "2025-08-03": [
        {
            "date": "2025-08-03",
            "time": "00:00:00",
            "date display": "03.08.2025",
            "price_eur": 95.14,
            "price": 186.08,
            "volume": 2464.6
        },
        {
            "date": "2025-08-03",
            "time": "01:00:00",
            "date display": "03.08.2025",
            "price_eur": 78.06,
            "price": 152.67,
            "volume": 3517.1
        },
        {
            "date": "2025-08-03",
            "time": "02:00:00",
            "date display": "03.08.2025",
            "price_eur": 70.94,
            "price": 138.75,
            "volume": 3443.2
        },
        {
            "date": "2025-08-03",
            "time": "03:00:00",
            "date display": "03.08.2025",
            "price_eur": 69.73,
            "price": 136.38,
            "volume": 3435.9
        },
        {
            "date": "2025-08-03",
            "time": "04:00:00",
            "date display": "03.08.2025",
            "price_eur": 67.57,
            "price": 132.16,
            "volume": 3462.8
        },
        {
            "date": "2025-08-03",
            "time": "05:00:00",
            "date display": "03.08.2025",
            "price_eur": 61.7,
            "price": 120.67,
            "volume": 3376.5
        },
        {
            "date": "2025-08-03",
            "time": "06:00:00",
            "date display": "03.08.2025",
            "price_eur": 47.7,
            "price": 93.29,
            "volume": 3453.9
        },
        {
            "date": "2025-08-03",
            "time": "07:00:00",
            "date display": "03.08.2025",
            "price_eur": 26.23,
            "price": 51.3,
            "volume": 3261.9
        },
        {
            "date": "2025-08-03",
            "time": "08:00:00",
            "date display": "03.08.2025",
            "price_eur": 6.16,
            "price": 12.05,
            "volume": 2882.3
        },
        {
            "date": "2025-08-03",
            "time": "09:00:00",
            "date display": "03.08.2025",
            "price_eur": 0.0,
            "price": 0.0,
            "volume": 3481.3
        },
        {
            "date": "2025-08-03",
            "time": "10:00:00",
            "date display": "03.08.2025",
            "price_eur": -1.01,
            "price": -1.98,
            "volume": 3570.6
        },
        {
            "date": "2025-08-03",
            "time": "11:00:00",
            "date display": "03.08.2025",
            "price_eur": -2.1,
            "price": -4.11,
            "volume": 3819.6
        },
        {
            "date": "2025-08-03",
            "time": "12:00:00",
            "date display": "03.08.2025",
            "price_eur": -3.0,
            "price": -5.87,
            "volume": 3795.1
        },
        {
            "date": "2025-08-03",
            "time": "13:00:00",
            "date display": "03.08.2025",
            "price_eur": 0.0,
            "price": 0.0,
            "volume": 3944.4
        },
        {
            "date": "2025-08-03",
            "time": "14:00:00",
            "date display": "03.08.2025",
            "price_eur": 0.0,
            "price": 0.0,
            "volume": 3809.6
        },
        {
            "date": "2025-08-03",
            "time": "15:00:00",
            "date display": "03.08.2025",
            "price_eur": 0.0,
            "price": 0.0,
            "volume": 3600.2
        },
        {
            "date": "2025-08-03",
            "time": "16:00:00",
            "date display": "03.08.2025",
            "price_eur": 5.0,
            "price": 9.78,
            "volume": 3742.1
        },
        {
            "date": "2025-08-03",
            "time": "17:00:00",
            "date display": "03.08.2025",
            "price_eur": 84.0,
            "price": 164.29,
            "volume": 3384.2
        },
        {
            "date": "2025-08-03",
            "time": "18:00:00",
            "date display": "03.08.2025",
            "price_eur": 123.08,
            "price": 240.72,
            "volume": 2419.0
        },
        {
            "date": "2025-08-03",
            "time": "19:00:00",
            "date display": "03.08.2025",
            "price_eur": 115.44,
            "price": 225.78,
            "volume": 2238.8
        },
        {
            "date": "2025-08-03",
            "time": "20:00:00",
            "date display": "03.08.2025",
            "price_eur": 157.4,
            "price": 307.85,
            "volume": 2279.8
        },
        {
            "date": "2025-08-03",
            "time": "21:00:00",
            "date display": "03.08.2025",
            "price_eur": 130.1,
            "price": 254.45,
            "volume": 2270.0
        },
        {
            "date": "2025-08-03",
            "time": "22:00:00",
            "date display": "03.08.2025",
            "price_eur": 114.94,
            "price": 224.8,
            "volume": 3028.1
        },
        {
            "date": "2025-08-03",
            "time": "23:00:00",
            "date display": "03.08.2025",
            "price_eur": 85.09,
            "price": 166.42,
            "volume": 3520.6
        }
    ],
    "2025-08-04": [
        {
            "date": "2025-08-04",
            "time": "00:00:00",
            "date display": "04.08.2025",
            "price_eur": 84.34,
            "price": 164.95,
            "volume": 3503.6
        },
        {
            "date": "2025-08-04",
            "time": "01:00:00",
            "date display": "04.08.2025",
            "price_eur": 70.07,
            "price": 137.05,
            "volume": 3452.1
        },
        {
            "date": "2025-08-04",
            "time": "02:00:00",
            "date display": "04.08.2025",
            "price_eur": 69.97,
            "price": 136.85,
            "volume": 3487.6
        },
        {
            "date": "2025-08-04",
            "time": "03:00:00",
            "date display": "04.08.2025",
            "price_eur": 69.47,
            "price": 135.87,
            "volume": 3527.7
        },
        {
            "date": "2025-08-04",
            "time": "04:00:00",
            "date display": "04.08.2025",
            "price_eur": 72.49,
            "price": 141.78,
            "volume": 3605.5
        },
        {
            "date": "2025-08-04",
            "time": "05:00:00",
            "date display": "04.08.2025",
            "price_eur": 87.21,
            "price": 170.57,
            "volume": 3014.8
        },
        {
            "date": "2025-08-04",
            "time": "06:00:00",
            "date display": "04.08.2025",
            "price_eur": 93.77,
            "price": 183.4,
            "volume": 2793.4
        },
        {
            "date": "2025-08-04",
            "time": "07:00:00",
            "date display": "04.08.2025",
            "price_eur": 101.39,
            "price": 198.3,
            "volume": 2560.8
        },
        {
            "date": "2025-08-04",
            "time": "08:00:00",
            "date display": "04.08.2025",
            "price_eur": 88.23,
            "price": 172.56,
            "volume": 3455.9
        },
        {
            "date": "2025-08-04",
            "time": "09:00:00",
            "date display": "04.08.2025",
            "price_eur": 71.7,
            "price": 140.23,
            "volume": 2975.7
        },
        {
            "date": "2025-08-04",
            "time": "10:00:00",
            "date display": "04.08.2025",
            "price_eur": 63.07,
            "price": 123.35,
            "volume": 3017.2
        },
        {
            "date": "2025-08-04",
            "time": "11:00:00",
            "date display": "04.08.2025",
            "price_eur": 50.24,
            "price": 98.26,
            "volume": 2973.3
        },
        {
            "date": "2025-08-04",
            "time": "12:00:00",
            "date display": "04.08.2025",
            "price_eur": 14.71,
            "price": 28.77,
            "volume": 2731.9
        },
        {
            "date": "2025-08-04",
            "time": "13:00:00",
            "date display": "04.08.2025",
            "price_eur": 4.05,
            "price": 7.92,
            "volume": 3309.4
        },
        {
            "date": "2025-08-04",
            "time": "14:00:00",
            "date display": "04.08.2025",
            "price_eur": 0.66,
            "price": 1.29,
            "volume": 3526.4
        },
        {
            "date": "2025-08-04",
            "time": "15:00:00",
            "date display": "04.08.2025",
            "price_eur": 30.0,
            "price": 58.67,
            "volume": 3469.8
        },
        {
            "date": "2025-08-04",
            "time": "16:00:00",
            "date display": "04.08.2025",
            "price_eur": 65.9,
            "price": 128.89,
            "volume": 3080.8
        },
        {
            "date": "2025-08-04",
            "time": "17:00:00",
            "date display": "04.08.2025",
            "price_eur": 124.35,
            "price": 243.21,
            "volume": 2599.3
        },
        {
            "date": "2025-08-04",
            "time": "18:00:00",
            "date display": "04.08.2025",
            "price_eur": 147.75,
            "price": 288.97,
            "volume": 2402.2
        },
        {
            "date": "2025-08-04",
            "time": "19:00:00",
            "date display": "04.08.2025",
            "price_eur": 191.82,
            "price": 375.17,
            "volume": 2943.3
        },
        {
            "date": "2025-08-04",
            "time": "20:00:00",
            "date display": "04.08.2025",
            "price_eur": 215.81,
            "price": 422.09,
            "volume": 2914.0
        },
        {
            "date": "2025-08-04",
            "time": "21:00:00",
            "date display": "04.08.2025",
            "price_eur": 136.27,
            "price": 266.52,
            "volume": 2786.4
        },
        {
            "date": "2025-08-04",
            "time": "22:00:00",
            "date display": "04.08.2025",
            "price_eur": 122.22,
            "price": 239.04,
            "volume": 2545.2
        },
        {
            "date": "2025-08-04",
            "time": "23:00:00",
            "date display": "04.08.2025",
            "price_eur": 88.64,
            "price": 173.36,
            "volume": 3371.9
        }
    ],
    "2025-08-05": [
        {
            "date": "2025-08-05",
            "time": "00:00:00",
            "date display": "05.08.2025",
            "price_eur": 95.99,
            "price": 187.74,
            "volume": 3187.5
        },
        {
            "date": "2025-08-05",
            "time": "01:00:00",
            "date display": "05.08.2025",
            "price_eur": 90.82,
            "price": 177.63,
            "volume": 3634.3
        },
        {
            "date": "2025-08-05",
            "time": "02:00:00",
            "date display": "05.08.2025",
            "price_eur": 63.96,
            "price": 125.09,
            "volume": 3828.1
        },
        {
            "date": "2025-08-05",
            "time": "03:00:00",
            "date display": "05.08.2025",
            "price_eur": 59.02,
            "price": 115.43,
            "volume": 3817.7
        },
        {
            "date": "2025-08-05",
            "time": "04:00:00",
            "date display": "05.08.2025",
            "price_eur": 62.85,
            "price": 122.92,
            "volume": 3831.6
        },
        {
            "date": "2025-08-05",
            "time": "05:00:00",
            "date display": "05.08.2025",
            "price_eur": 88.64,
            "price": 173.36,
            "volume": 3674.9
        },
        {
            "date": "2025-08-05",
            "time": "06:00:00",
            "date display": "05.08.2025",
            "price_eur": 99.9,
            "price": 195.39,
            "volume": 3451.1
        },
        {
            "date": "2025-08-05",
            "time": "07:00:00",
            "date display": "05.08.2025",
            "price_eur": 94.23,
            "price": 184.3,
            "volume": 3196.0
        },
        {
            "date": "2025-08-05",
            "time": "08:00:00",
            "date display": "05.08.2025",
            "price_eur": 73.82,
            "price": 144.38,
            "volume": 3285.1
        },
        {
            "date": "2025-08-05",
            "time": "09:00:00",
            "date display": "05.08.2025",
            "price_eur": 3.82,
            "price": 7.47,
            "volume": 3897.5
        },
        {
            "date": "2025-08-05",
            "time": "10:00:00",
            "date display": "05.08.2025",
            "price_eur": 0.0,
            "price": 0.0,
            "volume": 3544.8
        },
        {
            "date": "2025-08-05",
            "time": "11:00:00",
            "date display": "05.08.2025",
            "price_eur": 0.01,
            "price": 0.02,
            "volume": 4023.3
        },
        {
            "date": "2025-08-05",
            "time": "12:00:00",
            "date display": "05.08.2025",
            "price_eur": 0.01,
            "price": 0.02,
            "volume": 4045.3
        },
        {
            "date": "2025-08-05",
            "time": "13:00:00",
            "date display": "05.08.2025",
            "price_eur": 5.11,
            "price": 9.99,
            "volume": 3494.6
        },
        {
            "date": "2025-08-05",
            "time": "14:00:00",
            "date display": "05.08.2025",
            "price_eur": 5.0,
            "price": 9.78,
            "volume": 3914.0
        },
        {
            "date": "2025-08-05",
            "time": "15:00:00",
            "date display": "05.08.2025",
            "price_eur": 8.43,
            "price": 16.49,
            "volume": 3932.9
        },
        {
            "date": "2025-08-05",
            "time": "16:00:00",
            "date display": "05.08.2025",
            "price_eur": 64.87,
            "price": 126.87,
            "volume": 3557.3
        },
        {
            "date": "2025-08-05",
            "time": "17:00:00",
            "date display": "05.08.2025",
            "price_eur": 103.95,
            "price": 203.31,
            "volume": 2598.7
        },
        {
            "date": "2025-08-05",
            "time": "18:00:00",
            "date display": "05.08.2025",
            "price_eur": 121.03,
            "price": 236.71,
            "volume": 3038.4
        },
        {
            "date": "2025-08-05",
            "time": "19:00:00",
            "date display": "05.08.2025",
            "price_eur": 148.71,
            "price": 290.85,
            "volume": 3570.4
        },
        {
            "date": "2025-08-05",
            "time": "20:00:00",
            "date display": "05.08.2025",
            "price_eur": 180.18,
            "price": 352.4,
            "volume": 3713.9
        },
        {
            "date": "2025-08-05",
            "time": "21:00:00",
            "date display": "05.08.2025",
            "price_eur": 136.07,
            "price": 266.13,
            "volume": 3855.4
        },
        {
            "date": "2025-08-05",
            "time": "22:00:00",
            "date display": "05.08.2025",
            "price_eur": 123.27,
            "price": 241.1,
            "volume": 2820.3
        },
        {
            "date": "2025-08-05",
            "time": "23:00:00",
            "date display": "05.08.2025",
            "price_eur": 88.83,
            "price": 173.74,
            "volume": 2452.5
        }
    ],
    "2025-08-06": [
        {
            "date": "2025-08-06",
            "time": "00:00:00",
            "date display": "06.08.2025",
            "price_eur": 77.04,
            "price": 150.68,
            "volume": 3498.1
        },
        {
            "date": "2025-08-06",
            "time": "01:00:00",
            "date display": "06.08.2025",
            "price_eur": 59.98,
            "price": 117.31,
            "volume": 3916.6
        },
        {
            "date": "2025-08-06",
            "time": "02:00:00",
            "date display": "06.08.2025",
            "price_eur": 73.06,
            "price": 142.89,
            "volume": 3647.9
        },
        {
            "date": "2025-08-06",
            "time": "03:00:00",
            "date display": "06.08.2025",
            "price_eur": 77.58,
            "price": 151.73,
            "volume": 3563.3
        },
        {
            "date": "2025-08-06",
            "time": "04:00:00",
            "date display": "06.08.2025",
            "price_eur": 72.91,
            "price": 142.6,
            "volume": 3545.4
        },
        {
            "date": "2025-08-06",
            "time": "05:00:00",
            "date display": "06.08.2025",
            "price_eur": 82.26,
            "price": 160.89,
            "volume": 3167.0
        },
        {
            "date": "2025-08-06",
            "time": "06:00:00",
            "date display": "06.08.2025",
            "price_eur": 96.7,
            "price": 189.13,
            "volume": 2727.4
        },
        {
            "date": "2025-08-06",
            "time": "07:00:00",
            "date display": "06.08.2025",
            "price_eur": 98.03,
            "price": 191.73,
            "volume": 3682.1
        },
        {
            "date": "2025-08-06",
            "time": "08:00:00",
            "date display": "06.08.2025",
            "price_eur": 83.98,
            "price": 164.25,
            "volume": 3761.5
        },
        {
            "date": "2025-08-06",
            "time": "09:00:00",
            "date display": "06.08.2025",
            "price_eur": 27.83,
            "price": 54.43,
            "volume": 3350.6
        },
        {
            "date": "2025-08-06",
            "time": "10:00:00",
            "date display": "06.08.2025",
            "price_eur": 0.01,
            "price": 0.02,
            "volume": 3323.2
        },
        {
            "date": "2025-08-06",
            "time": "11:00:00",
            "date display": "06.08.2025",
            "price_eur": 0.98,
            "price": 1.92,
            "volume": 3260.9
        },
        {
            "date": "2025-08-06",
            "time": "12:00:00",
            "date display": "06.08.2025",
            "price_eur": 4.99,
            "price": 9.76,
            "volume": 3137.3
        },
        {
            "date": "2025-08-06",
            "time": "13:00:00",
            "date display": "06.08.2025",
            "price_eur": 4.91,
            "price": 9.6,
            "volume": 2991.8
        },
        {
            "date": "2025-08-06",
            "time": "14:00:00",
            "date display": "06.08.2025",
            "price_eur": 3.13,
            "price": 6.12,
            "volume": 2845.2
        },
        {
            "date": "2025-08-06",
            "time": "15:00:00",
            "date display": "06.08.2025",
            "price_eur": 27.27,
            "price": 53.34,
            "volume": 2850.9
        },
        {
            "date": "2025-08-06",
            "time": "16:00:00",
            "date display": "06.08.2025",
            "price_eur": 86.62,
            "price": 169.41,
            "volume": 2735.7
        },
        {
            "date": "2025-08-06",
            "time": "17:00:00",
            "date display": "06.08.2025",
            "price_eur": 98.76,
            "price": 193.16,
            "volume": 2635.1
        },
        {
            "date": "2025-08-06",
            "time": "18:00:00",
            "date display": "06.08.2025",
            "price_eur": 107.91,
            "price": 211.05,
            "volume": 3675.0
        },
        {
            "date": "2025-08-06",
            "time": "19:00:00",
            "date display": "06.08.2025",
            "price_eur": 122.5,
            "price": 239.59,
            "volume": 4183.3
        },
        {
            "date": "2025-08-06",
            "time": "20:00:00",
            "date display": "06.08.2025",
            "price_eur": 123.0,
            "price": 240.57,
            "volume": 4150.3
        },
        {
            "date": "2025-08-06",
            "time": "21:00:00",
            "date display": "06.08.2025",
            "price_eur": 112.67,
            "price": 220.36,
            "volume": 4128.2
        },
        {
            "date": "2025-08-06",
            "time": "22:00:00",
            "date display": "06.08.2025",
            "price_eur": 110.0,
            "price": 215.14,
            "volume": 3736.7
        },
        {
            "date": "2025-08-06",
            "time": "23:00:00",
            "date display": "06.08.2025",
            "price_eur": 101.26,
            "price": 198.05,
            "volume": 3362.9
        }
    ],
    "2025-08-07": [
        {
            "date": "2025-08-07",
            "time": "00:00:00",
            "date display": "07.08.2025",
            "price_eur": 97.45,
            "price": 190.6,
            "volume": 3212.7
        },
        {
            "date": "2025-08-07",
            "time": "01:00:00",
            "date display": "07.08.2025",
            "price_eur": 94.97,
            "price": 185.75,
            "volume": 3113.9
        },
        {
            "date": "2025-08-07",
            "time": "02:00:00",
            "date display": "07.08.2025",
            "price_eur": 88.1,
            "price": 172.31,
            "volume": 2810.1
        },
        {
            "date": "2025-08-07",
            "time": "03:00:00",
            "date display": "07.08.2025",
            "price_eur": 80.67,
            "price": 157.78,
            "volume": 2789.0
        },
        {
            "date": "2025-08-07",
            "time": "04:00:00",
            "date display": "07.08.2025",
            "price_eur": 84.32,
            "price": 164.92,
            "volume": 2866.9
        },
        {
            "date": "2025-08-07",
            "time": "05:00:00",
            "date display": "07.08.2025",
            "price_eur": 71.96,
            "price": 140.74,
            "volume": 3146.1
        },
        {
            "date": "2025-08-07",
            "time": "06:00:00",
            "date display": "07.08.2025",
            "price_eur": 78.85,
            "price": 154.22,
            "volume": 3608.9
        },
        {
            "date": "2025-08-07",
            "time": "07:00:00",
            "date display": "07.08.2025",
            "price_eur": 59.43,
            "price": 116.23,
            "volume": 3575.5
        },
        {
            "date": "2025-08-07",
            "time": "08:00:00",
            "date display": "07.08.2025",
            "price_eur": 15.08,
            "price": 29.49,
            "volume": 3989.1
        },
        {
            "date": "2025-08-07",
            "time": "09:00:00",
            "date display": "07.08.2025",
            "price_eur": 5.11,
            "price": 9.99,
            "volume": 3804.4
        },
        {
            "date": "2025-08-07",
            "time": "10:00:00",
            "date display": "07.08.2025",
            "price_eur": 0.0,
            "price": 0.0,
            "volume": 3419.5
        },
        {
            "date": "2025-08-07",
            "time": "11:00:00",
            "date display": "07.08.2025",
            "price_eur": 0.0,
            "price": 0.0,
            "volume": 4104.5
        },
        {
            "date": "2025-08-07",
            "time": "12:00:00",
            "date display": "07.08.2025",
            "price_eur": 0.0,
            "price": 0.0,
            "volume": 4026.5
        },
        {
            "date": "2025-08-07",
            "time": "13:00:00",
            "date display": "07.08.2025",
            "price_eur": 0.0,
            "price": 0.0,
            "volume": 4019.0
        },
        {
            "date": "2025-08-07",
            "time": "14:00:00",
            "date display": "07.08.2025",
            "price_eur": 0.0,
            "price": 0.0,
            "volume": 3856.5
        },
        {
            "date": "2025-08-07",
            "time": "15:00:00",
            "date display": "07.08.2025",
            "price_eur": 0.01,
            "price": 0.02,
            "volume": 3406.9
        },
        {
            "date": "2025-08-07",
            "time": "16:00:00",
            "date display": "07.08.2025",
            "price_eur": 38.72,
            "price": 75.73,
            "volume": 3184.7
        },
        {
            "date": "2025-08-07",
            "time": "17:00:00",
            "date display": "07.08.2025",
            "price_eur": 85.19,
            "price": 166.62,
            "volume": 3102.7
        },
        {
            "date": "2025-08-07",
            "time": "18:00:00",
            "date display": "07.08.2025",
            "price_eur": 121.03,
            "price": 236.71,
            "volume": 3411.8
        },
        {
            "date": "2025-08-07",
            "time": "19:00:00",
            "date display": "07.08.2025",
            "price_eur": 164.68,
            "price": 322.09,
            "volume": 4393.4
        },
        {
            "date": "2025-08-07",
            "time": "20:00:00",
            "date display": "07.08.2025",
            "price_eur": 172.22,
            "price": 336.83,
            "volume": 4239.5
        },
        {
            "date": "2025-08-07",
            "time": "21:00:00",
            "date display": "07.08.2025",
            "price_eur": 131.0,
            "price": 256.21,
            "volume": 4031.0
        },
        {
            "date": "2025-08-07",
            "time": "22:00:00",
            "date display": "07.08.2025",
            "price_eur": 110.0,
            "price": 215.14,
            "volume": 3587.9
        },
        {
            "date": "2025-08-07",
            "time": "23:00:00",
            "date display": "07.08.2025",
            "price_eur": 101.28,
            "price": 198.09,
            "volume": 3140.2
        }
    ],
    "2025-08-08": [
        {
            "date": "2025-08-08",
            "time": "00:00:00",
            "date display": "08.08.2025",
            "price_eur": 94.14,
            "price": 184.12,
            "volume": 3062.1
        },
        {
            "date": "2025-08-08",
            "time": "01:00:00",
            "date display": "08.08.2025",
            "price_eur": 90.1,
            "price": 176.22,
            "volume": 2847.7
        },
        {
            "date": "2025-08-08",
            "time": "02:00:00",
            "date display": "08.08.2025",
            "price_eur": 86.25,
            "price": 168.69,
            "volume": 2895.7
        },
        {
            "date": "2025-08-08",
            "time": "03:00:00",
            "date display": "08.08.2025",
            "price_eur": 83.09,
            "price": 162.51,
            "volume": 2876.4
        },
        {
            "date": "2025-08-08",
            "time": "04:00:00",
            "date display": "08.08.2025",
            "price_eur": 81.33,
            "price": 159.07,
            "volume": 2994.2
        },
        {
            "date": "2025-08-08",
            "time": "05:00:00",
            "date display": "08.08.2025",
            "price_eur": 91.3,
            "price": 178.57,
            "volume": 3594.4
        },
        {
            "date": "2025-08-08",
            "time": "06:00:00",
            "date display": "08.08.2025",
            "price_eur": 88.87,
            "price": 173.81,
            "volume": 4087.3
        },
        {
            "date": "2025-08-08",
            "time": "07:00:00",
            "date display": "08.08.2025",
            "price_eur": 72.31,
            "price": 141.43,
            "volume": 4194.2
        },
        {
            "date": "2025-08-08",
            "time": "08:00:00",
            "date display": "08.08.2025",
            "price_eur": 35.35,
            "price": 69.14,
            "volume": 4427.7
        },
        {
            "date": "2025-08-08",
            "time": "09:00:00",
            "date display": "08.08.2025",
            "price_eur": 12.78,
            "price": 25.0,
            "volume": 4452.6
        },
        {
            "date": "2025-08-08",
            "time": "10:00:00",
            "date display": "08.08.2025",
            "price_eur": 8.73,
            "price": 17.07,
            "volume": 4405.0
        },
        {
            "date": "2025-08-08",
            "time": "11:00:00",
            "date display": "08.08.2025",
            "price_eur": 5.12,
            "price": 10.01,
            "volume": 4095.6
        },
        {
            "date": "2025-08-08",
            "time": "12:00:00",
            "date display": "08.08.2025",
            "price_eur": 0.0,
            "price": 0.0,
            "volume": 3389.1
        },
        {
            "date": "2025-08-08",
            "time": "13:00:00",
            "date display": "08.08.2025",
            "price_eur": -0.01,
            "price": -0.02,
            "volume": 3491.6
        },
        {
            "date": "2025-08-08",
            "time": "14:00:00",
            "date display": "08.08.2025",
            "price_eur": -0.01,
            "price": -0.02,
            "volume": 3207.5
        },
        {
            "date": "2025-08-08",
            "time": "15:00:00",
            "date display": "08.08.2025",
            "price_eur": 0.0,
            "price": 0.0,
            "volume": 3161.1
        },
        {
            "date": "2025-08-08",
            "time": "16:00:00",
            "date display": "08.08.2025",
            "price_eur": 10.49,
            "price": 20.52,
            "volume": 3222.0
        },
        {
            "date": "2025-08-08",
            "time": "17:00:00",
            "date display": "08.08.2025",
            "price_eur": 86.26,
            "price": 168.71,
            "volume": 2645.5
        },
        {
            "date": "2025-08-08",
            "time": "18:00:00",
            "date display": "08.08.2025",
            "price_eur": 140.73,
            "price": 275.24,
            "volume": 3581.8
        },
        {
            "date": "2025-08-08",
            "time": "19:00:00",
            "date display": "08.08.2025",
            "price_eur": 170.67,
            "price": 333.8,
            "volume": 4298.0
        },
        {
            "date": "2025-08-08",
            "time": "20:00:00",
            "date display": "08.08.2025",
            "price_eur": 224.86,
            "price": 439.79,
            "volume": 4226.4
        },
        {
            "date": "2025-08-08",
            "time": "21:00:00",
            "date display": "08.08.2025",
            "price_eur": 156.17,
            "price": 305.44,
            "volume": 4147.3
        },
        {
            "date": "2025-08-08",
            "time": "22:00:00",
            "date display": "08.08.2025",
            "price_eur": 125.88,
            "price": 246.2,
            "volume": 3736.7
        },
        {
            "date": "2025-08-08",
            "time": "23:00:00",
            "date display": "08.08.2025",
            "price_eur": 109.16,
            "price": 213.5,
            "volume": 2821.8
        }
    ],
    "2025-08-09": [
        {
            "date": "2025-08-09",
            "time": "00:00:00",
            "date display": "09.08.2025",
            "price_eur": 102.86,
            "price": 201.18,
            "volume": 2947.5
        },
        {
            "date": "2025-08-09",
            "time": "01:00:00",
            "date display": "09.08.2025",
            "price_eur": 102.32,
            "price": 200.12,
            "volume": 2480.2
        },
        {
            "date": "2025-08-09",
            "time": "02:00:00",
            "date display": "09.08.2025",
            "price_eur": 101.61,
            "price": 198.73,
            "volume": 2655.8
        },
        {
            "date": "2025-08-09",
            "time": "03:00:00",
            "date display": "09.08.2025",
            "price_eur": 98.7,
            "price": 193.04,
            "volume": 3239.3
        },
        {
            "date": "2025-08-09",
            "time": "04:00:00",
            "date display": "09.08.2025",
            "price_eur": 98.59,
            "price": 192.83,
            "volume": 3336.5
        },
        {
            "date": "2025-08-09",
            "time": "05:00:00",
            "date display": "09.08.2025",
            "price_eur": 98.65,
            "price": 192.94,
            "volume": 3475.6
        },
        {
            "date": "2025-08-09",
            "time": "06:00:00",
            "date display": "09.08.2025",
            "price_eur": 98.05,
            "price": 191.77,
            "volume": 3167.4
        },
        {
            "date": "2025-08-09",
            "time": "07:00:00",
            "date display": "09.08.2025",
            "price_eur": 61.82,
            "price": 120.91,
            "volume": 3561.7
        },
        {
            "date": "2025-08-09",
            "time": "08:00:00",
            "date display": "09.08.2025",
            "price_eur": 68.41,
            "price": 133.8,
            "volume": 3465.8
        },
        {
            "date": "2025-08-09",
            "time": "09:00:00",
            "date display": "09.08.2025",
            "price_eur": 15.34,
            "price": 30.0,
            "volume": 3718.8
        },
        {
            "date": "2025-08-09",
            "time": "10:00:00",
            "date display": "09.08.2025",
            "price_eur": -0.02,
            "price": -0.04,
            "volume": 2681.3
        },
        {
            "date": "2025-08-09",
            "time": "11:00:00",
            "date display": "09.08.2025",
            "price_eur": -1.0,
            "price": -1.96,
            "volume": 2901.0
        },
        {
            "date": "2025-08-09",
            "time": "12:00:00",
            "date display": "09.08.2025",
            "price_eur": -9.96,
            "price": -19.48,
            "volume": 3150.6
        },
        {
            "date": "2025-08-09",
            "time": "13:00:00",
            "date display": "09.08.2025",
            "price_eur": -16.39,
            "price": -32.06,
            "volume": 3165.3
        },
        {
            "date": "2025-08-09",
            "time": "14:00:00",
            "date display": "09.08.2025",
            "price_eur": -15.0,
            "price": -29.34,
            "volume": 3125.8
        },
        {
            "date": "2025-08-09",
            "time": "15:00:00",
            "date display": "09.08.2025",
            "price_eur": -2.87,
            "price": -5.61,
            "volume": 3066.5
        },
        {
            "date": "2025-08-09",
            "time": "16:00:00",
            "date display": "09.08.2025",
            "price_eur": 0.06,
            "price": 0.12,
            "volume": 2794.0
        },
        {
            "date": "2025-08-09",
            "time": "17:00:00",
            "date display": "09.08.2025",
            "price_eur": 76.49,
            "price": 149.6,
            "volume": 2397.8
        },
        {
            "date": "2025-08-09",
            "time": "18:00:00",
            "date display": "09.08.2025",
            "price_eur": 149.74,
            "price": 292.87,
            "volume": 2899.0
        },
        {
            "date": "2025-08-09",
            "time": "19:00:00",
            "date display": "09.08.2025",
            "price_eur": 124.9,
            "price": 244.28,
            "volume": 3898.2
        },
        {
            "date": "2025-08-09",
            "time": "20:00:00",
            "date display": "09.08.2025",
            "price_eur": 131.66,
            "price": 257.5,
            "volume": 3880.8
        },
        {
            "date": "2025-08-09",
            "time": "21:00:00",
            "date display": "09.08.2025",
            "price_eur": 133.92,
            "price": 261.92,
            "volume": 3788.5
        },
        {
            "date": "2025-08-09",
            "time": "22:00:00",
            "date display": "09.08.2025",
            "price_eur": 117.72,
            "price": 230.24,
            "volume": 3240.4
        },
        {
            "date": "2025-08-09",
            "time": "23:00:00",
            "date display": "09.08.2025",
            "price_eur": 95.18,
            "price": 186.16,
            "volume": 2392.9
        }
    ],
    "2025-08-10": [
        {
            "date": "2025-08-10",
            "time": "00:00:00",
            "date display": "10.08.2025",
            "price_eur": 84.7,
            "price": 165.66,
            "volume": 2860.4
        },
        {
            "date": "2025-08-10",
            "time": "01:00:00",
            "date display": "10.08.2025",
            "price_eur": 83.02,
            "price": 162.37,
            "volume": 2434.1
        },
        {
            "date": "2025-08-10",
            "time": "02:00:00",
            "date display": "10.08.2025",
            "price_eur": 82.78,
            "price": 161.9,
            "volume": 2237.2
        },
        {
            "date": "2025-08-10",
            "time": "03:00:00",
            "date display": "10.08.2025",
            "price_eur": 77.58,
            "price": 151.73,
            "volume": 2213.0
        },
        {
            "date": "2025-08-10",
            "time": "04:00:00",
            "date display": "10.08.2025",
            "price_eur": 80.25,
            "price": 156.96,
            "volume": 2201.2
        },
        {
            "date": "2025-08-10",
            "time": "05:00:00",
            "date display": "10.08.2025",
            "price_eur": 83.2,
            "price": 162.73,
            "volume": 2266.3
        },
        {
            "date": "2025-08-10",
            "time": "06:00:00",
            "date display": "10.08.2025",
            "price_eur": 81.51,
            "price": 159.42,
            "volume": 2350.5
        },
        {
            "date": "2025-08-10",
            "time": "07:00:00",
            "date display": "10.08.2025",
            "price_eur": 70.12,
            "price": 137.14,
            "volume": 3387.6
        },
        {
            "date": "2025-08-10",
            "time": "08:00:00",
            "date display": "10.08.2025",
            "price_eur": 26.44,
            "price": 51.71,
            "volume": 3210.1
        },
        {
            "date": "2025-08-10",
            "time": "09:00:00",
            "date display": "10.08.2025",
            "price_eur": -0.01,
            "price": -0.02,
            "volume": 2426.4
        },
        {
            "date": "2025-08-10",
            "time": "10:00:00",
            "date display": "10.08.2025",
            "price_eur": -3.46,
            "price": -6.77,
            "volume": 2802.2
        },
        {
            "date": "2025-08-10",
            "time": "11:00:00",
            "date display": "10.08.2025",
            "price_eur": -15.6,
            "price": -30.51,
            "volume": 3114.2
        },
        {
            "date": "2025-08-10",
            "time": "12:00:00",
            "date display": "10.08.2025",
            "price_eur": -38.26,
            "price": -74.83,
            "volume": 3220.3
        },
        {
            "date": "2025-08-10",
            "time": "13:00:00",
            "date display": "10.08.2025",
            "price_eur": -60.57,
            "price": -118.46,
            "volume": 3262.7
        },
        {
            "date": "2025-08-10",
            "time": "14:00:00",
            "date display": "10.08.2025",
            "price_eur": -49.41,
            "price": -96.64,
            "volume": 3337.7
        },
        {
            "date": "2025-08-10",
            "time": "15:00:00",
            "date display": "10.08.2025",
            "price_eur": -20.01,
            "price": -39.14,
            "volume": 3249.9
        },
        {
            "date": "2025-08-10",
            "time": "16:00:00",
            "date display": "10.08.2025",
            "price_eur": 0.0,
            "price": 0.0,
            "volume": 3128.6
        },
        {
            "date": "2025-08-10",
            "time": "17:00:00",
            "date display": "10.08.2025",
            "price_eur": 36.8,
            "price": 71.97,
            "volume": 2999.6
        },
        {
            "date": "2025-08-10",
            "time": "18:00:00",
            "date display": "10.08.2025",
            "price_eur": 97.42,
            "price": 190.54,
            "volume": 2317.6
        },
        {
            "date": "2025-08-10",
            "time": "19:00:00",
            "date display": "10.08.2025",
            "price_eur": 121.9,
            "price": 238.42,
            "volume": 2908.0
        },
        {
            "date": "2025-08-10",
            "time": "20:00:00",
            "date display": "10.08.2025",
            "price_eur": 138.32,
            "price": 270.53,
            "volume": 3449.2
        },
        {
            "date": "2025-08-10",
            "time": "21:00:00",
            "date display": "10.08.2025",
            "price_eur": 121.04,
            "price": 236.73,
            "volume": 3306.0
        },
        {
            "date": "2025-08-10",
            "time": "22:00:00",
            "date display": "10.08.2025",
            "price_eur": 106.75,
            "price": 208.78,
            "volume": 2737.4
        },
        {
            "date": "2025-08-10",
            "time": "23:00:00",
            "date display": "10.08.2025",
            "price_eur": 98.21,
            "price": 192.08,
            "volume": 2396.7
        }
    ],
    "2025-08-11": [
        {
            "date": "2025-08-11",
            "time": "00:00:00",
            "date display": "11.08.2025",
            "price_eur": 99.81,
            "price": 195.21,
            "volume": 2790.9
        },
        {
            "date": "2025-08-11",
            "time": "01:00:00",
            "date display": "11.08.2025",
            "price_eur": 91.69,
            "price": 179.33,
            "volume": 2705.6
        },
        {
            "date": "2025-08-11",
            "time": "02:00:00",
            "date display": "11.08.2025",
            "price_eur": 87.28,
            "price": 170.7,
            "volume": 2702.7
        },
        {
            "date": "2025-08-11",
            "time": "03:00:00",
            "date display": "11.08.2025",
            "price_eur": 84.83,
            "price": 165.91,
            "volume": 2719.4
        },
        {
            "date": "2025-08-11",
            "time": "04:00:00",
            "date display": "11.08.2025",
            "price_eur": 92.9,
            "price": 181.7,
            "volume": 3053.0
        },
        {
            "date": "2025-08-11",
            "time": "05:00:00",
            "date display": "11.08.2025",
            "price_eur": 104.03,
            "price": 203.46,
            "volume": 3563.4
        },
        {
            "date": "2025-08-11",
            "time": "06:00:00",
            "date display": "11.08.2025",
            "price_eur": 125.47,
            "price": 245.4,
            "volume": 3666.1
        },
        {
            "date": "2025-08-11",
            "time": "07:00:00",
            "date display": "11.08.2025",
            "price_eur": 71.7,
            "price": 140.23,
            "volume": 3712.5
        },
        {
            "date": "2025-08-11",
            "time": "08:00:00",
            "date display": "11.08.2025",
            "price_eur": 12.27,
            "price": 24.0,
            "volume": 3893.7
        },
        {
            "date": "2025-08-11",
            "time": "09:00:00",
            "date display": "11.08.2025",
            "price_eur": 12.79,
            "price": 25.02,
            "volume": 4523.8
        },
        {
            "date": "2025-08-11",
            "time": "10:00:00",
            "date display": "11.08.2025",
            "price_eur": 8.43,
            "price": 16.49,
            "volume": 4126.9
        },
        {
            "date": "2025-08-11",
            "time": "11:00:00",
            "date display": "11.08.2025",
            "price_eur": 2.54,
            "price": 4.97,
            "volume": 3847.7
        },
        {
            "date": "2025-08-11",
            "time": "12:00:00",
            "date display": "11.08.2025",
            "price_eur": 0.0,
            "price": 0.0,
            "volume": 3930.5
        },
        {
            "date": "2025-08-11",
            "time": "13:00:00",
            "date display": "11.08.2025",
            "price_eur": 0.0,
            "price": 0.0,
            "volume": 4044.9
        },
        {
            "date": "2025-08-11",
            "time": "14:00:00",
            "date display": "11.08.2025",
            "price_eur": 0.0,
            "price": 0.0,
            "volume": 4182.2
        },
        {
            "date": "2025-08-11",
            "time": "15:00:00",
            "date display": "11.08.2025",
            "price_eur": 9.0,
            "price": 17.6,
            "volume": 3954.8
        },
        {
            "date": "2025-08-11",
            "time": "16:00:00",
            "date display": "11.08.2025",
            "price_eur": 58.97,
            "price": 115.34,
            "volume": 3707.2
        },
        {
            "date": "2025-08-11",
            "time": "17:00:00",
            "date display": "11.08.2025",
            "price_eur": 97.2,
            "price": 190.11,
            "volume": 3484.6
        },
        {
            "date": "2025-08-11",
            "time": "18:00:00",
            "date display": "11.08.2025",
            "price_eur": 143.19,
            "price": 280.06,
            "volume": 3073.1
        },
        {
            "date": "2025-08-11",
            "time": "19:00:00",
            "date display": "11.08.2025",
            "price_eur": 193.43,
            "price": 378.32,
            "volume": 3884.2
        },
        {
            "date": "2025-08-11",
            "time": "20:00:00",
            "date display": "11.08.2025",
            "price_eur": 236.24,
            "price": 462.05,
            "volume": 3965.3
        },
        {
            "date": "2025-08-11",
            "time": "21:00:00",
            "date display": "11.08.2025",
            "price_eur": 140.53,
            "price": 274.85,
            "volume": 3747.8
        },
        {
            "date": "2025-08-11",
            "time": "22:00:00",
            "date display": "11.08.2025",
            "price_eur": 108.87,
            "price": 212.93,
            "volume": 3244.1
        },
        {
            "date": "2025-08-11",
            "time": "23:00:00",
            "date display": "11.08.2025",
            "price_eur": 96.0,
            "price": 187.76,
            "volume": 3093.7
        }
    ],
    "2025-08-12": [
        {
            "date": "2025-08-12",
            "time": "00:00:00",
            "date display": "12.08.2025",
            "price_eur": 93.0,
            "price": 181.89,
            "volume": 2956.9
        },
        {
            "date": "2025-08-12",
            "time": "01:00:00",
            "date display": "12.08.2025",
            "price_eur": 89.67,
            "price": 175.38,
            "volume": 2849.9
        },
        {
            "date": "2025-08-12",
            "time": "02:00:00",
            "date display": "12.08.2025",
            "price_eur": 85.41,
            "price": 167.05,
            "volume": 2924.0
        },
        {
            "date": "2025-08-12",
            "time": "03:00:00",
            "date display": "12.08.2025",
            "price_eur": 83.6,
            "price": 163.51,
            "volume": 3028.0
        },
        {
            "date": "2025-08-12",
            "time": "04:00:00",
            "date display": "12.08.2025",
            "price_eur": 83.78,
            "price": 163.86,
            "volume": 3184.6
        },
        {
            "date": "2025-08-12",
            "time": "05:00:00",
            "date display": "12.08.2025",
            "price_eur": 93.42,
            "price": 182.71,
            "volume": 3272.0
        },
        {
            "date": "2025-08-12",
            "time": "06:00:00",
            "date display": "12.08.2025",
            "price_eur": 87.74,
            "price": 171.6,
            "volume": 3403.4
        },
        {
            "date": "2025-08-12",
            "time": "07:00:00",
            "date display": "12.08.2025",
            "price_eur": 71.69,
            "price": 140.21,
            "volume": 3683.9
        },
        {
            "date": "2025-08-12",
            "time": "08:00:00",
            "date display": "12.08.2025",
            "price_eur": 80.0,
            "price": 156.47,
            "volume": 4012.2
        },
        {
            "date": "2025-08-12",
            "time": "09:00:00",
            "date display": "12.08.2025",
            "price_eur": 16.0,
            "price": 31.29,
            "volume": 4267.9
        },
        {
            "date": "2025-08-12",
            "time": "10:00:00",
            "date display": "12.08.2025",
            "price_eur": 15.34,
            "price": 30.0,
            "volume": 4333.2
        },
        {
            "date": "2025-08-12",
            "time": "11:00:00",
            "date display": "12.08.2025",
            "price_eur": 12.8,
            "price": 25.03,
            "volume": 4153.1
        },
        {
            "date": "2025-08-12",
            "time": "12:00:00",
            "date display": "12.08.2025",
            "price_eur": 8.38,
            "price": 16.39,
            "volume": 3476.8
        },
        {
            "date": "2025-08-12",
            "time": "13:00:00",
            "date display": "12.08.2025",
            "price_eur": 3.0,
            "price": 5.87,
            "volume": 3742.9
        },
        {
            "date": "2025-08-12",
            "time": "14:00:00",
            "date display": "12.08.2025",
            "price_eur": 5.15,
            "price": 10.07,
            "volume": 3564.3
        },
        {
            "date": "2025-08-12",
            "time": "15:00:00",
            "date display": "12.08.2025",
            "price_eur": 35.05,
            "price": 68.55,
            "volume": 3801.9
        },
        {
            "date": "2025-08-12",
            "time": "16:00:00",
            "date display": "12.08.2025",
            "price_eur": 73.15,
            "price": 143.07,
            "volume": 3438.6
        },
        {
            "date": "2025-08-12",
            "time": "17:00:00",
            "date display": "12.08.2025",
            "price_eur": 109.06,
            "price": 213.3,
            "volume": 3064.1
        },
        {
            "date": "2025-08-12",
            "time": "18:00:00",
            "date display": "12.08.2025",
            "price_eur": 141.32,
            "price": 276.4,
            "volume": 3702.3
        },
        {
            "date": "2025-08-12",
            "time": "19:00:00",
            "date display": "12.08.2025",
            "price_eur": 237.05,
            "price": 463.63,
            "volume": 4204.9
        },
        {
            "date": "2025-08-12",
            "time": "20:00:00",
            "date display": "12.08.2025",
            "price_eur": 276.02,
            "price": 539.85,
            "volume": 4297.3
        },
        {
            "date": "2025-08-12",
            "time": "21:00:00",
            "date display": "12.08.2025",
            "price_eur": 148.88,
            "price": 291.18,
            "volume": 4169.8
        },
        {
            "date": "2025-08-12",
            "time": "22:00:00",
            "date display": "12.08.2025",
            "price_eur": 114.47,
            "price": 223.88,
            "volume": 3661.4
        },
        {
            "date": "2025-08-12",
            "time": "23:00:00",
            "date display": "12.08.2025",
            "price_eur": 98.16,
            "price": 191.98,
            "volume": 2966.0
        }
    ],
    "2025-08-13": [
        {
            "date": "2025-08-13",
            "time": "00:00:00",
            "date display": "13.08.2025",
            "price_eur": 96.69,
            "price": 189.11,
            "volume": 3284.3
        },
        {
            "date": "2025-08-13",
            "time": "01:00:00",
            "date display": "13.08.2025",
            "price_eur": 90.0,
            "price": 176.02,
            "volume": 3193.4
        },
        {
            "date": "2025-08-13",
            "time": "02:00:00",
            "date display": "13.08.2025",
            "price_eur": 86.89,
            "price": 169.94,
            "volume": 3363.3
        },
        {
            "date": "2025-08-13",
            "time": "03:00:00",
            "date display": "13.08.2025",
            "price_eur": 84.71,
            "price": 165.68,
            "volume": 3399.5
        },
        {
            "date": "2025-08-13",
            "time": "04:00:00",
            "date display": "13.08.2025",
            "price_eur": 87.07,
            "price": 170.29,
            "volume": 3457.1
        },
        {
            "date": "2025-08-13",
            "time": "05:00:00",
            "date display": "13.08.2025",
            "price_eur": 86.87,
            "price": 169.9,
            "volume": 3800.6
        },
        {
            "date": "2025-08-13",
            "time": "06:00:00",
            "date display": "13.08.2025",
            "price_eur": 107.92,
            "price": 211.07,
            "volume": 4185.1
        },
        {
            "date": "2025-08-13",
            "time": "07:00:00",
            "date display": "13.08.2025",
            "price_eur": 79.6,
            "price": 155.68,
            "volume": 4472.7
        },
        {
            "date": "2025-08-13",
            "time": "08:00:00",
            "date display": "13.08.2025",
            "price_eur": 33.71,
            "price": 65.93,
            "volume": 4380.7
        },
        {
            "date": "2025-08-13",
            "time": "09:00:00",
            "date display": "13.08.2025",
            "price_eur": 13.62,
            "price": 26.64,
            "volume": 4583.6
        },
        {
            "date": "2025-08-13",
            "time": "10:00:00",
            "date display": "13.08.2025",
            "price_eur": 6.69,
            "price": 13.08,
            "volume": 4064.6
        },
        {
            "date": "2025-08-13",
            "time": "11:00:00",
            "date display": "13.08.2025",
            "price_eur": 8.44,
            "price": 16.51,
            "volume": 4395.1
        },
        {
            "date": "2025-08-13",
            "time": "12:00:00",
            "date display": "13.08.2025",
            "price_eur": 10.23,
            "price": 20.01,
            "volume": 4366.5
        },
        {
            "date": "2025-08-13",
            "time": "13:00:00",
            "date display": "13.08.2025",
            "price_eur": 11.37,
            "price": 22.24,
            "volume": 4419.1
        },
        {
            "date": "2025-08-13",
            "time": "14:00:00",
            "date display": "13.08.2025",
            "price_eur": 41.24,
            "price": 80.66,
            "volume": 4929.2
        },
        {
            "date": "2025-08-13",
            "time": "15:00:00",
            "date display": "13.08.2025",
            "price_eur": 70.9,
            "price": 138.67,
            "volume": 4536.7
        },
        {
            "date": "2025-08-13",
            "time": "16:00:00",
            "date display": "13.08.2025",
            "price_eur": 84.3,
            "price": 164.88,
            "volume": 3975.7
        },
        {
            "date": "2025-08-13",
            "time": "17:00:00",
            "date display": "13.08.2025",
            "price_eur": 96.64,
            "price": 189.01,
            "volume": 2891.7
        },
        {
            "date": "2025-08-13",
            "time": "18:00:00",
            "date display": "13.08.2025",
            "price_eur": 138.47,
            "price": 270.82,
            "volume": 3850.9
        },
        {
            "date": "2025-08-13",
            "time": "19:00:00",
            "date display": "13.08.2025",
            "price_eur": 249.03,
            "price": 487.06,
            "volume": 4277.8
        },
        {
            "date": "2025-08-13",
            "time": "20:00:00",
            "date display": "13.08.2025",
            "price_eur": 237.91,
            "price": 465.31,
            "volume": 4329.2
        },
        {
            "date": "2025-08-13",
            "time": "21:00:00",
            "date display": "13.08.2025",
            "price_eur": 142.35,
            "price": 278.41,
            "volume": 4151.3
        },
        {
            "date": "2025-08-13",
            "time": "22:00:00",
            "date display": "13.08.2025",
            "price_eur": 123.21,
            "price": 240.98,
            "volume": 3572.6
        },
        {
            "date": "2025-08-13",
            "time": "23:00:00",
            "date display": "13.08.2025",
            "price_eur": 106.27,
            "price": 207.85,
            "volume": 2801.7
        }
    ],
    "2025-08-14": [
        {
            "date": "2025-08-14",
            "time": "00:00:00",
            "date display": "14.08.2025",
            "price_eur": 98.1,
            "price": 191.87,
            "volume": 3338.0
        },
        {
            "date": "2025-08-14",
            "time": "01:00:00",
            "date display": "14.08.2025",
            "price_eur": 92.0,
            "price": 179.94,
            "volume": 2916.9
        },
        {
            "date": "2025-08-14",
            "time": "02:00:00",
            "date display": "14.08.2025",
            "price_eur": 88.45,
            "price": 172.99,
            "volume": 3011.5
        },
        {
            "date": "2025-08-14",
            "time": "03:00:00",
            "date display": "14.08.2025",
            "price_eur": 87.69,
            "price": 171.51,
            "volume": 3130.8
        },
        {
            "date": "2025-08-14",
            "time": "04:00:00",
            "date display": "14.08.2025",
            "price_eur": 88.05,
            "price": 172.21,
            "volume": 3287.1
        },
        {
            "date": "2025-08-14",
            "time": "05:00:00",
            "date display": "14.08.2025",
            "price_eur": 96.7,
            "price": 189.13,
            "volume": 3699.8
        },
        {
            "date": "2025-08-14",
            "time": "06:00:00",
            "date display": "14.08.2025",
            "price_eur": 101.16,
            "price": 197.85,
            "volume": 3807.6
        },
        {
            "date": "2025-08-14",
            "time": "07:00:00",
            "date display": "14.08.2025",
            "price_eur": 86.29,
            "price": 168.77,
            "volume": 4107.2
        },
        {
            "date": "2025-08-14",
            "time": "08:00:00",
            "date display": "14.08.2025",
            "price_eur": 69.8,
            "price": 136.52,
            "volume": 4163.7
        },
        {
            "date": "2025-08-14",
            "time": "09:00:00",
            "date display": "14.08.2025",
            "price_eur": 12.78,
            "price": 25.0,
            "volume": 4562.3
        },
        {
            "date": "2025-08-14",
            "time": "10:00:00",
            "date display": "14.08.2025",
            "price_eur": 12.78,
            "price": 25.0,
            "volume": 4481.2
        },
        {
            "date": "2025-08-14",
            "time": "11:00:00",
            "date display": "14.08.2025",
            "price_eur": 12.78,
            "price": 25.0,
            "volume": 4688.1
        },
        {
            "date": "2025-08-14",
            "time": "12:00:00",
            "date display": "14.08.2025",
            "price_eur": 12.86,
            "price": 25.15,
            "volume": 4775.4
        },
        {
            "date": "2025-08-14",
            "time": "13:00:00",
            "date display": "14.08.2025",
            "price_eur": 15.99,
            "price": 31.27,
            "volume": 4810.1
        },
        {
            "date": "2025-08-14",
            "time": "14:00:00",
            "date display": "14.08.2025",
            "price_eur": 54.9,
            "price": 107.38,
            "volume": 4450.6
        },
        {
            "date": "2025-08-14",
            "time": "15:00:00",
            "date display": "14.08.2025",
            "price_eur": 69.43,
            "price": 135.79,
            "volume": 3699.9
        },
        {
            "date": "2025-08-14",
            "time": "16:00:00",
            "date display": "14.08.2025",
            "price_eur": 78.99,
            "price": 154.49,
            "volume": 3043.2
        },
        {
            "date": "2025-08-14",
            "time": "17:00:00",
            "date display": "14.08.2025",
            "price_eur": 101.71,
            "price": 198.93,
            "volume": 2955.4
        },
        {
            "date": "2025-08-14",
            "time": "18:00:00",
            "date display": "14.08.2025",
            "price_eur": 141.99,
            "price": 277.71,
            "volume": 3751.0
        },
        {
            "date": "2025-08-14",
            "time": "19:00:00",
            "date display": "14.08.2025",
            "price_eur": 261.43,
            "price": 511.31,
            "volume": 4321.7
        },
        {
            "date": "2025-08-14",
            "time": "20:00:00",
            "date display": "14.08.2025",
            "price_eur": 304.92,
            "price": 596.37,
            "volume": 4344.7
        },
        {
            "date": "2025-08-14",
            "time": "21:00:00",
            "date display": "14.08.2025",
            "price_eur": 158.07,
            "price": 309.16,
            "volume": 4139.1
        },
        {
            "date": "2025-08-14",
            "time": "22:00:00",
            "date display": "14.08.2025",
            "price_eur": 122.93,
            "price": 240.43,
            "volume": 3249.5
        },
        {
            "date": "2025-08-14",
            "time": "23:00:00",
            "date display": "14.08.2025",
            "price_eur": 105.95,
            "price": 207.22,
            "volume": 2971.5
        }
    ],
    "2025-08-15": [
        {
            "date": "2025-08-15",
            "time": "00:00:00",
            "date display": "15.08.2025",
            "price_eur": 99.43,
            "price": 194.47,
            "volume": 2997.7
        },
        {
            "date": "2025-08-15",
            "time": "01:00:00",
            "date display": "15.08.2025",
            "price_eur": 98.35,
            "price": 192.36,
            "volume": 2850.2
        },
        {
            "date": "2025-08-15",
            "time": "02:00:00",
            "date display": "15.08.2025",
            "price_eur": 92.86,
            "price": 181.62,
            "volume": 3107.0
        },
        {
            "date": "2025-08-15",
            "time": "03:00:00",
            "date display": "15.08.2025",
            "price_eur": 88.75,
            "price": 173.58,
            "volume": 3137.1
        },
        {
            "date": "2025-08-15",
            "time": "04:00:00",
            "date display": "15.08.2025",
            "price_eur": 90.78,
            "price": 177.55,
            "volume": 3612.2
        },
        {
            "date": "2025-08-15",
            "time": "05:00:00",
            "date display": "15.08.2025",
            "price_eur": 94.8,
            "price": 185.41,
            "volume": 4047.6
        },
        {
            "date": "2025-08-15",
            "time": "06:00:00",
            "date display": "15.08.2025",
            "price_eur": 99.66,
            "price": 194.92,
            "volume": 4142.5
        },
        {
            "date": "2025-08-15",
            "time": "07:00:00",
            "date display": "15.08.2025",
            "price_eur": 99.76,
            "price": 195.11,
            "volume": 4215.2
        },
        {
            "date": "2025-08-15",
            "time": "08:00:00",
            "date display": "15.08.2025",
            "price_eur": 94.27,
            "price": 184.38,
            "volume": 4181.9
        },
        {
            "date": "2025-08-15",
            "time": "09:00:00",
            "date display": "15.08.2025",
            "price_eur": 71.9,
            "price": 140.62,
            "volume": 4353.2
        },
        {
            "date": "2025-08-15",
            "time": "10:00:00",
            "date display": "15.08.2025",
            "price_eur": 25.47,
            "price": 49.81,
            "volume": 4291.4
        },
        {
            "date": "2025-08-15",
            "time": "11:00:00",
            "date display": "15.08.2025",
            "price_eur": 3.0,
            "price": 5.87,
            "volume": 3749.1
        },
        {
            "date": "2025-08-15",
            "time": "12:00:00",
            "date display": "15.08.2025",
            "price_eur": 0.08,
            "price": 0.16,
            "volume": 3981.7
        },
        {
            "date": "2025-08-15",
            "time": "13:00:00",
            "date display": "15.08.2025",
            "price_eur": 0.0,
            "price": 0.0,
            "volume": 4123.2
        },
        {
            "date": "2025-08-15",
            "time": "14:00:00",
            "date display": "15.08.2025",
            "price_eur": 0.0,
            "price": 0.0,
            "volume": 3859.5
        },
        {
            "date": "2025-08-15",
            "time": "15:00:00",
            "date display": "15.08.2025",
            "price_eur": 1.73,
            "price": 3.38,
            "volume": 3481.9
        },
        {
            "date": "2025-08-15",
            "time": "16:00:00",
            "date display": "15.08.2025",
            "price_eur": 39.5,
            "price": 77.26,
            "volume": 3512.6
        },
        {
            "date": "2025-08-15",
            "time": "17:00:00",
            "date display": "15.08.2025",
            "price_eur": 84.59,
            "price": 165.44,
            "volume": 3086.1
        },
        {
            "date": "2025-08-15",
            "time": "18:00:00",
            "date display": "15.08.2025",
            "price_eur": 105.57,
            "price": 206.48,
            "volume": 4016.8
        },
        {
            "date": "2025-08-15",
            "time": "19:00:00",
            "date display": "15.08.2025",
            "price_eur": 120.27,
            "price": 235.23,
            "volume": 4267.3
        },
        {
            "date": "2025-08-15",
            "time": "20:00:00",
            "date display": "15.08.2025",
            "price_eur": 100.79,
            "price": 197.13,
            "volume": 4331.2
        },
        {
            "date": "2025-08-15",
            "time": "21:00:00",
            "date display": "15.08.2025",
            "price_eur": 111.76,
            "price": 218.58,
            "volume": 4142.4
        },
        {
            "date": "2025-08-15",
            "time": "22:00:00",
            "date display": "15.08.2025",
            "price_eur": 105.8,
            "price": 206.93,
            "volume": 3733.0
        },
        {
            "date": "2025-08-15",
            "time": "23:00:00",
            "date display": "15.08.2025",
            "price_eur": 95.79,
            "price": 187.35,
            "volume": 3200.1
        }
    ],
    "2025-08-16": [
        {
            "date": "2025-08-16",
            "time": "00:00:00",
            "date display": "16.08.2025",
            "price_eur": 94.73,
            "price": 185.28,
            "volume": 2395.0
        },
        {
            "date": "2025-08-16",
            "time": "01:00:00",
            "date display": "16.08.2025",
            "price_eur": 89.78,
            "price": 175.59,
            "volume": 2341.9
        },
        {
            "date": "2025-08-16",
            "time": "02:00:00",
            "date display": "16.08.2025",
            "price_eur": 88.49,
            "price": 173.07,
            "volume": 2311.3
        },
        {
            "date": "2025-08-16",
            "time": "03:00:00",
            "date display": "16.08.2025",
            "price_eur": 83.36,
            "price": 163.04,
            "volume": 2305.2
        },
        {
            "date": "2025-08-16",
            "time": "04:00:00",
            "date display": "16.08.2025",
            "price_eur": 81.77,
            "price": 159.93,
            "volume": 2485.6
        },
        {
            "date": "2025-08-16",
            "time": "05:00:00",
            "date display": "16.08.2025",
            "price_eur": 84.59,
            "price": 165.44,
            "volume": 2443.5
        },
        {
            "date": "2025-08-16",
            "time": "06:00:00",
            "date display": "16.08.2025",
            "price_eur": 87.59,
            "price": 171.31,
            "volume": 2452.7
        },
        {
            "date": "2025-08-16",
            "time": "07:00:00",
            "date display": "16.08.2025",
            "price_eur": 87.38,
            "price": 170.9,
            "volume": 2667.0
        },
        {
            "date": "2025-08-16",
            "time": "08:00:00",
            "date display": "16.08.2025",
            "price_eur": 78.17,
            "price": 152.89,
            "volume": 3303.7
        },
        {
            "date": "2025-08-16",
            "time": "09:00:00",
            "date display": "16.08.2025",
            "price_eur": 33.45,
            "price": 65.42,
            "volume": 3668.3
        },
        {
            "date": "2025-08-16",
            "time": "10:00:00",
            "date display": "16.08.2025",
            "price_eur": 15.34,
            "price": 30.0,
            "volume": 3736.0
        },
        {
            "date": "2025-08-16",
            "time": "11:00:00",
            "date display": "16.08.2025",
            "price_eur": 3.8,
            "price": 7.43,
            "volume": 2699.4
        },
        {
            "date": "2025-08-16",
            "time": "12:00:00",
            "date display": "16.08.2025",
            "price_eur": 0.17,
            "price": 0.33,
            "volume": 2911.6
        },
        {
            "date": "2025-08-16",
            "time": "13:00:00",
            "date display": "16.08.2025",
            "price_eur": -0.01,
            "price": -0.02,
            "volume": 3046.8
        },
        {
            "date": "2025-08-16",
            "time": "14:00:00",
            "date display": "16.08.2025",
            "price_eur": -0.01,
            "price": -0.02,
            "volume": 3027.6
        },
        {
            "date": "2025-08-16",
            "time": "15:00:00",
            "date display": "16.08.2025",
            "price_eur": 0.01,
            "price": 0.02,
            "volume": 3028.4
        },
        {
            "date": "2025-08-16",
            "time": "16:00:00",
            "date display": "16.08.2025",
            "price_eur": 37.79,
            "price": 73.91,
            "volume": 2859.8
        },
        {
            "date": "2025-08-16",
            "time": "17:00:00",
            "date display": "16.08.2025",
            "price_eur": 85.05,
            "price": 166.34,
            "volume": 2317.1
        },
        {
            "date": "2025-08-16",
            "time": "18:00:00",
            "date display": "16.08.2025",
            "price_eur": 138.88,
            "price": 271.63,
            "volume": 2544.1
        },
        {
            "date": "2025-08-16",
            "time": "19:00:00",
            "date display": "16.08.2025",
            "price_eur": 178.26,
            "price": 348.65,
            "volume": 2933.0
        },
        {
            "date": "2025-08-16",
            "time": "20:00:00",
            "date display": "16.08.2025",
            "price_eur": 190.69,
            "price": 372.96,
            "volume": 2985.9
        },
        {
            "date": "2025-08-16",
            "time": "21:00:00",
            "date display": "16.08.2025",
            "price_eur": 146.71,
            "price": 286.94,
            "volume": 2959.5
        },
        {
            "date": "2025-08-16",
            "time": "22:00:00",
            "date display": "16.08.2025",
            "price_eur": 104.07,
            "price": 203.54,
            "volume": 2451.0
        },
        {
            "date": "2025-08-16",
            "time": "23:00:00",
